{
  "version": "figure-spiral/blueprint/v1",
  "figure_id": "aris_movie_director_method",
  "title": {
    "main": "ARIS-Movie-Director",
    "sub": "Audited narrative-comic generation"
  },
  "canvas": {
    "width": 1960,
    "height": 1000,
    "background": "#FFFFFF"
  },
  "render_policy": {
    "label_policy": "baked",
    "target_profile": "readme",
    "max_rounds": 4
  },
  "assets": [
    {
      "id": "cast",
      "path": "identity_sheet.png",
      "role": "identity_sheet",
      "lock_traits": [
        "researcher: black hair, glasses, black tee",
        "executor: brown hair, blue hoodie, no beard",
        "reviewer: black hair, beard, green hoodie"
      ]
    }
  ],
  "groups": [
    {
      "id": "p1",
      "label_exact": "1 · Authored Source of Truth",
      "bounds": {
        "x": 250,
        "y": 150,
        "w": 320,
        "h": 560
      },
      "tone": "blue"
    },
    {
      "id": "p2",
      "label_exact": "2 · The Audited Spiral  (per panel)",
      "bounds": {
        "x": 620,
        "y": 150,
        "w": 740,
        "h": 700
      },
      "tone": "peach"
    },
    {
      "id": "p3",
      "label_exact": "3 · Assembly + Release",
      "bounds": {
        "x": 1470,
        "y": 150,
        "w": 430,
        "h": 560
      },
      "tone": "green"
    }
  ],
  "nodes": [
    {
      "id": "researcher",
      "label_exact": "researcher",
      "pos": {
        "x": 130,
        "y": 420
      },
      "desc_exact": "hands over the night",
      "size": {
        "w": 150,
        "h": 200
      },
      "shape": "character",
      "visual_hint": "the ARIS researcher chibi handing over a 'story brief' document, exhausted, T-24h",
      "asset_ref": "cast",
      "expected_tokens": [
        "hands",
        "night",
        "over",
        "researcher",
        "the"
      ]
    },
    {
      "id": "brief",
      "label_exact": "story brief",
      "pos": {
        "x": 130,
        "y": 600
      },
      "desc_exact": "24h deadline",
      "size": {
        "w": 130,
        "h": 60
      },
      "shape": "document",
      "accent": "muted",
      "expected_tokens": [
        "24h",
        "brief",
        "deadline",
        "story"
      ]
    },
    {
      "id": "outline",
      "label_exact": "outline",
      "pos": {
        "x": 410,
        "y": 250
      },
      "desc_exact": "story beats",
      "group": "p1",
      "size": {
        "w": 200,
        "h": 70
      },
      "shape": "document",
      "accent": "blue_accent",
      "expected_tokens": [
        "beats",
        "outline",
        "story"
      ]
    },
    {
      "id": "storyboard",
      "label_exact": "storyboard",
      "pos": {
        "x": 410,
        "y": 370
      },
      "desc_exact": "scene + dialogue + literals",
      "group": "p1",
      "size": {
        "w": 200,
        "h": 70
      },
      "shape": "document",
      "accent": "blue_accent",
      "expected_tokens": [
        "dialogue",
        "literals",
        "scene",
        "storyboard"
      ]
    },
    {
      "id": "comicjson",
      "label_exact": "comic.json",
      "pos": {
        "x": 410,
        "y": 560
      },
      "desc_exact": "single source of truth",
      "group": "p1",
      "size": {
        "w": 240,
        "h": 86
      },
      "shape": "datastore",
      "accent": "blue_accent",
      "expected_tokens": [
        "comic.json",
        "of",
        "single",
        "source",
        "truth"
      ]
    },
    {
      "id": "blueprint",
      "label_exact": "content-SVG",
      "pos": {
        "x": 760,
        "y": 300
      },
      "desc_exact": "exact SVG blueprint",
      "group": "p2",
      "size": {
        "w": 200,
        "h": 74
      },
      "shape": "document",
      "accent": "peach_accent",
      "visual_hint": "a precise wireframe blueprint sheet",
      "expected_tokens": [
        "SVG",
        "blueprint",
        "content-SVG",
        "exact"
      ]
    },
    {
      "id": "bake",
      "label_exact": "image_gen BAKE",
      "pos": {
        "x": 1020,
        "y": 300
      },
      "desc_exact": "blueprint + identity",
      "group": "p2",
      "size": {
        "w": 230,
        "h": 86
      },
      "shape": "process",
      "accent": "peach_accent",
      "visual_hint": "a pixel-art comic panel being baked",
      "expected_tokens": [
        "BAKE",
        "blueprint",
        "identity",
        "image_gen"
      ]
    },
    {
      "id": "gate",
      "label_exact": "panel_gate",
      "pos": {
        "x": 1020,
        "y": 520
      },
      "desc_exact": "CC | Gemini | Codex",
      "group": "p2",
      "size": {
        "w": 340,
        "h": 175
      },
      "shape": "gate",
      "accent": "red",
      "visual_hint": "an audit desk: the blue EXECUTOR holds the baked PNG, the green REVIEWER inspects a token-diff with a magnifier; three reviewer chips CC / Gemini / Codex",
      "asset_ref": "cast",
      "expected_tokens": [
        "CC",
        "Codex",
        "Gemini",
        "panel_gate"
      ]
    },
    {
      "id": "verdict",
      "label_exact": "verdict",
      "pos": {
        "x": 1020,
        "y": 680
      },
      "desc_exact": "literal diff",
      "group": "p2",
      "size": {
        "w": 220,
        "h": 64
      },
      "shape": "diamond",
      "accent": "peach_accent",
      "expected_tokens": [
        "diff",
        "literal",
        "verdict"
      ]
    },
    {
      "id": "keep",
      "label_exact": "KEEP",
      "pos": {
        "x": 1280,
        "y": 680
      },
      "desc_exact": "panel accepted",
      "group": "p2",
      "size": {
        "w": 110,
        "h": 56
      },
      "shape": "process",
      "accent": "green_accent",
      "expected_tokens": [
        "KEEP",
        "accepted",
        "panel"
      ]
    },
    {
      "id": "wiki",
      "label_exact": "research-wiki",
      "pos": {
        "x": 760,
        "y": 600
      },
      "desc_exact": "failures logged",
      "group": "p2",
      "size": {
        "w": 200,
        "h": 110
      },
      "shape": "datastore",
      "accent": "peach_accent",
      "visual_hint": "a memory cylinder logging every attempt",
      "expected_tokens": [
        "failures",
        "logged",
        "research-wiki"
      ]
    },
    {
      "id": "assembly",
      "label_exact": "page assembly_gate",
      "pos": {
        "x": 1705,
        "y": 300
      },
      "desc_exact": "coherence + drift check",
      "group": "p3",
      "size": {
        "w": 240,
        "h": 86
      },
      "shape": "gate",
      "accent": "green_accent",
      "expected_tokens": [
        "assembly_gate",
        "check",
        "coherence",
        "drift",
        "page"
      ]
    },
    {
      "id": "viewer",
      "label_exact": "release",
      "pos": {
        "x": 1705,
        "y": 540
      },
      "desc_exact": "PNG panels + HTML",
      "group": "p3",
      "size": {
        "w": 240,
        "h": 120
      },
      "shape": "output",
      "accent": "green_accent",
      "visual_hint": "a finished pixel-art comic page thumbnail in a browser frame",
      "expected_tokens": [
        "HTML",
        "PNG",
        "panels",
        "release"
      ]
    }
  ],
  "edges": [
    {
      "from": "brief",
      "to": "outline",
      "kind": "flow"
    },
    {
      "from": "outline",
      "to": "comicjson",
      "kind": "flow"
    },
    {
      "from": "storyboard",
      "to": "comicjson",
      "kind": "flow"
    },
    {
      "from": "comicjson",
      "to": "blueprint",
      "kind": "flow",
      "label_exact": "source",
      "expected_tokens": [
        "source"
      ]
    },
    {
      "from": "blueprint",
      "to": "bake",
      "kind": "flow",
      "label_exact": "render",
      "expected_tokens": [
        "render"
      ]
    },
    {
      "from": "bake",
      "to": "gate",
      "kind": "flow"
    },
    {
      "from": "gate",
      "to": "verdict",
      "kind": "flow"
    },
    {
      "from": "verdict",
      "to": "keep",
      "kind": "keep",
      "label_exact": "keep",
      "expected_tokens": [
        "keep"
      ]
    },
    {
      "from": "verdict",
      "to": "bake",
      "kind": "retry",
      "label_exact": "RETRY (max 4)",
      "expected_tokens": [
        "RETRY",
        "max"
      ]
    },
    {
      "from": "gate",
      "to": "wiki",
      "kind": "flow",
      "label_exact": "write",
      "expected_tokens": [
        "write"
      ]
    },
    {
      "from": "keep",
      "to": "assembly",
      "kind": "flow"
    },
    {
      "from": "assembly",
      "to": "bake",
      "kind": "repair",
      "label_exact": "repair drift",
      "expected_tokens": [
        "drift",
        "repair"
      ]
    },
    {
      "from": "assembly",
      "to": "viewer",
      "kind": "flow",
      "label_exact": "accept",
      "expected_tokens": [
        "accept"
      ]
    }
  ],
  "callouts": [
    {
      "id": "punchline",
      "title_exact": "Looks right != pass",
      "lines_exact": [
        "a beautiful baked panel",
        "expected +6.2 / observed +6.25"
      ],
      "pos": {
        "x": 1020,
        "y": 860
      },
      "size": {
        "w": 420,
        "h": 150
      },
      "accent": "red",
      "expected_tokens": [
        "+6.2",
        "+6.25",
        "Looks",
        "baked",
        "beautiful",
        "expected",
        "observed",
        "panel",
        "pass",
        "right"
      ]
    }
  ],
  "style": {
    "theme": "academic_flat",
    "font_family": "Inter, Arial, sans-serif",
    "palette": {
      "text": "#1F2937",
      "muted": "#6B7280",
      "blue_fill": "#E5EEFB",
      "blue_stroke": "#9DBDEB",
      "blue_accent": "#2563EB",
      "peach_fill": "#FDEBD8",
      "peach_stroke": "#F4C18A",
      "peach_accent": "#EA580C",
      "green_fill": "#DEF5E6",
      "green_stroke": "#9BD9B0",
      "green_accent": "#0E9F6E",